{
  "$schema": "../../schemas/harness-config.schema.json",
  "project": {
    "name": "Frontend Backend Product",
    "slug": "frontend-backend-product",
    "harnessRepoName": "frontend-backend-product-structor"
  },
  "output": {
    "path": "../../../generated/frontend-backend-product-structor"
  },
  "models": {
    "openai": true,
    "anthropic": true
  },
  "consumers": [
    {
      "name": "product-frontend",
      "path": "./product-frontend",
      "purpose": "Frontend application repository",
      "validation": {
        "lint": "npm run lint",
        "build": "npm run build"
      }
    },
    {
      "name": "product-backend",
      "path": "./product-backend",
      "purpose": "Backend API repository",
      "validation": {
        "lint": "npm run lint",
        "test": "npm test"
      }
    }
  ]
}
