{
  "$schema": "../../schemas/harness-config.schema.json",
  "project": {
    "name": "Single Repo Product",
    "slug": "single-repo-product",
    "harnessRepoName": "single-repo-product-structor"
  },
  "output": {
    "path": "../../generated/single-repo-product-structor"
  },
  "models": {
    "openai": true,
    "anthropic": false
  },
  "consumers": [
    {
      "name": "single-repo-app",
      "path": "./single-repo-app",
      "purpose": "Application repository",
      "validation": {
        "lint": "npm run lint",
        "test": "npm test"
      }
    }
  ]
}
